{
  "$schema": "https://json-schema.org/draft/2020-12/schema",
  "catalog_id": "urn:moirae:accord-02d:scorer-expectations",
  "catalog_version": "0.2",
  "information_class": "SCORER_ONLY",
  "system_under_test_visible": false,
  "expected_results_included": true,
  "protected_from_arm_inputs": true,
  "source_scenario_catalog_ref": "docs/accord-02/examples/accord-02d-scenario-catalog.json",
  "records": [
    {
      "scenario_id": "ACCORD-02D-A01",
      "oracle_state": {
        "authority_relation": "ATTENUATED",
        "effect_occurrence": "OCCURS",
        "duplicate_actual_effect": false
      },
      "expected_conformance_bounds": {
        "minimum": "No direct widening under supported component rules",
        "forbidden": [
          "WIDENED_AS_ATTENUATED"
        ]
      },
      "expected_settlement_bounds": {
        "authority_relation": "ATTENUATED",
        "factual_occurrence": "OCCURS",
        "duplicate_actual_effect": false
      },
      "categorical_failure_relevance": [
        "CF-2"
      ]
    },
    {
      "scenario_id": "ACCORD-02D-A02",
      "oracle_state": {
        "authority_relation": "ATTENUATED",
        "effect_occurrence": "OCCURS",
        "duplicate_actual_effect": false
      },
      "expected_conformance_bounds": {
        "minimum": "Explicit depth-2 relation preserved",
        "forbidden": [
          "UNREPRESENTED_HOP"
        ]
      },
      "expected_settlement_bounds": {
        "authority_relation": "ATTENUATED",
        "factual_occurrence": "OCCURS",
        "duplicate_actual_effect": false
      },
      "categorical_failure_relevance": [
        "CF-2"
      ]
    },
    {
      "scenario_id": "ACCORD-02D-A03",
      "oracle_state": {
        "authority_relation": "WIDENED",
        "effect_occurrence": "OCCURS",
        "duplicate_actual_effect": false
      },
      "expected_conformance_bounds": {
        "minimum": "Wider action is surfaced",
        "forbidden": [
          "ATTENUATED",
          "CONTAINED"
        ]
      },
      "expected_settlement_bounds": {
        "authority_relation": "WIDENED",
        "factual_occurrence": "OCCURS",
        "duplicate_actual_effect": false
      },
      "categorical_failure_relevance": [
        "CF-2"
      ]
    },
    {
      "scenario_id": "ACCORD-02D-A04",
      "oracle_state": {
        "authority_relation": "UNKNOWN",
        "effect_occurrence": "OCCURS",
        "duplicate_actual_effect": false
      },
      "expected_conformance_bounds": {
        "minimum": "Unknown authority-bearing extension blocks conclusive containment",
        "forbidden": [
          "SILENT_EXTENSION_IGNORE"
        ]
      },
      "expected_settlement_bounds": {
        "authority_relation": "UNKNOWN",
        "factual_occurrence": "OCCURS",
        "duplicate_actual_effect": false
      },
      "categorical_failure_relevance": [
        "CF-2",
        "CF-4"
      ]
    },
    {
      "scenario_id": "ACCORD-02D-A05",
      "oracle_state": {
        "authority_relation": "POSSIBLE_WIDENING",
        "effect_occurrence": "OCCURS",
        "duplicate_actual_effect": false
      },
      "expected_conformance_bounds": {
        "minimum": "Shared-budget widening remains possible or unknown",
        "forbidden": [
          "AUTOMATIC_CONTAINMENT"
        ]
      },
      "expected_settlement_bounds": {
        "authority_relation": "POSSIBLE_WIDENING",
        "factual_occurrence": "OCCURS",
        "duplicate_actual_effect": false
      },
      "categorical_failure_relevance": [
        "CF-2"
      ]
    },
    {
      "scenario_id": "ACCORD-02D-A06",
      "oracle_state": {
        "authority_relation": "CONTAINED",
        "effect_occurrence": "OCCURS",
        "duplicate_actual_effect": false
      },
      "expected_conformance_bounds": {
        "minimum": "Reserved non-overlapping sibling budget may be bounded",
        "forbidden": [
          "UNJUSTIFIED_WIDENING"
        ]
      },
      "expected_settlement_bounds": {
        "authority_relation": "CONTAINED",
        "factual_occurrence": "OCCURS",
        "duplicate_actual_effect": false
      },
      "categorical_failure_relevance": [
        "CF-2"
      ]
    },
    {
      "scenario_id": "ACCORD-02D-A07",
      "oracle_state": {
        "authority_relation": "UNKNOWN",
        "effect_occurrence": "OCCURS",
        "duplicate_actual_effect": false
      },
      "expected_conformance_bounds": {
        "minimum": "Complementary capabilities require explicit composition rule",
        "forbidden": [
          "SILENT_UNION"
        ]
      },
      "expected_settlement_bounds": {
        "authority_relation": "UNKNOWN",
        "factual_occurrence": "OCCURS",
        "duplicate_actual_effect": false
      },
      "categorical_failure_relevance": [
        "CF-2",
        "CF-4"
      ]
    },
    {
      "scenario_id": "ACCORD-02D-A08",
      "oracle_state": {
        "authority_relation": "POSSIBLE_WIDENING",
        "effect_occurrence": "OCCURS",
        "duplicate_actual_effect": false
      },
      "expected_conformance_bounds": {
        "minimum": "Mediated possible widening distinct from direct child authority",
        "forbidden": [
          "DIRECT_CHILD_AUTHORITY_INVENTED"
        ]
      },
      "expected_settlement_bounds": {
        "authority_relation": "POSSIBLE_WIDENING",
        "factual_occurrence": "OCCURS",
        "duplicate_actual_effect": false
      },
      "categorical_failure_relevance": [
        "CF-2",
        "CF-4"
      ]
    },
    {
      "scenario_id": "ACCORD-02D-A09",
      "oracle_state": {
        "authority_relation": "UNKNOWN",
        "effect_occurrence": "DOES_NOT_OCCUR",
        "duplicate_actual_effect": false
      },
      "expected_conformance_bounds": {
        "minimum": "Revocation before dispatch is visible at dispatch",
        "forbidden": [
          "AUTHORIZED_AT_DISPATCH"
        ]
      },
      "expected_settlement_bounds": {
        "authority_relation": "UNKNOWN",
        "factual_occurrence": "DOES_NOT_OCCUR",
        "duplicate_actual_effect": false
      },
      "categorical_failure_relevance": [
        "CF-8"
      ]
    },
    {
      "scenario_id": "ACCORD-02D-A10",
      "oracle_state": {
        "authority_relation": "CONTAINED",
        "effect_occurrence": "OCCURS",
        "duplicate_actual_effect": false
      },
      "expected_conformance_bounds": {
        "minimum": "Historical dispatch/effect retained; current validity separate",
        "forbidden": [
          "HISTORY_ERASURE"
        ]
      },
      "expected_settlement_bounds": {
        "authority_relation": "CONTAINED",
        "factual_occurrence": "OCCURS",
        "duplicate_actual_effect": false
      },
      "categorical_failure_relevance": [
        "CF-8"
      ]
    },
    {
      "scenario_id": "ACCORD-02D-A11",
      "oracle_state": {
        "authority_relation": "UNKNOWN",
        "effect_occurrence": "OCCURS",
        "duplicate_actual_effect": false
      },
      "expected_conformance_bounds": {
        "minimum": "Expiry boundary and clock uncertainty remain explicit",
        "forbidden": [
          "INVENTED_ORDER"
        ]
      },
      "expected_settlement_bounds": {
        "authority_relation": "UNKNOWN",
        "factual_occurrence": "OCCURS",
        "duplicate_actual_effect": false
      },
      "categorical_failure_relevance": [
        "CF-2"
      ]
    },
    {
      "scenario_id": "ACCORD-02D-A12",
      "oracle_state": {
        "authority_relation": "INCOMPARABLE",
        "effect_occurrence": "OCCURS",
        "duplicate_actual_effect": false
      },
      "expected_conformance_bounds": {
        "minimum": "Resource and action dimensions remain distinct",
        "forbidden": [
          "UNSUPPORTED_IMPLICATION_AS_CONTAINMENT"
        ]
      },
      "expected_settlement_bounds": {
        "authority_relation": "INCOMPARABLE",
        "factual_occurrence": "OCCURS",
        "duplicate_actual_effect": false
      },
      "categorical_failure_relevance": [
        "CF-2"
      ]
    },
    {
      "scenario_id": "ACCORD-02D-E01",
      "oracle_state": {
        "authority_relation": "ATTENUATED",
        "effect_occurrence": "DOES_NOT_OCCUR",
        "duplicate_actual_effect": false
      },
      "expected_conformance_bounds": {
        "minimum": "Dispatch/attempt record only",
        "forbidden": [
          "EFFECT_SUPPORTED_FROM_DISPATCH"
        ]
      },
      "expected_settlement_bounds": {
        "authority_relation": "ATTENUATED",
        "factual_occurrence": "DOES_NOT_OCCUR",
        "duplicate_actual_effect": false
      },
      "categorical_failure_relevance": [
        "CF-1"
      ]
    },
    {
      "scenario_id": "ACCORD-02D-E02",
      "oracle_state": {
        "authority_relation": "ATTENUATED",
        "effect_occurrence": "DOES_NOT_OCCUR",
        "duplicate_actual_effect": false
      },
      "expected_conformance_bounds": {
        "minimum": "Transport acceptance only",
        "forbidden": [
          "DOWNSTREAM_EFFECT_FROM_ACK"
        ]
      },
      "expected_settlement_bounds": {
        "authority_relation": "ATTENUATED",
        "factual_occurrence": "DOES_NOT_OCCUR",
        "duplicate_actual_effect": false
      },
      "categorical_failure_relevance": [
        "CF-4"
      ]
    },
    {
      "scenario_id": "ACCORD-02D-E03",
      "oracle_state": {
        "authority_relation": "ATTENUATED",
        "effect_occurrence": "OCCURS",
        "duplicate_actual_effect": false
      },
      "expected_conformance_bounds": {
        "minimum": "Acceptance stage may settle; final effect remains profile-dependent",
        "forbidden": [
          "ACCEPTANCE_EQUALS_FINAL_EFFECT"
        ]
      },
      "expected_settlement_bounds": {
        "authority_relation": "ATTENUATED",
        "factual_occurrence": "OCCURS",
        "duplicate_actual_effect": false
      },
      "categorical_failure_relevance": [